code,description,outcome,title
COSC2674,"The Programming Internet of Things (PIoT) course will teach you how to program with current and leading IoT technologies for building IoT solutions for Smart Homes, Smart Campus etc., using IoT sensor and devices. What will you learn - gain an an understanding of using Raspberry Pi and appropriate programming frameworks as the base to build all the projects, learn the fundamentals of IoT and then build a standard framework for developing all the applications. learn to capture data using sensors, and the basics of analysis and visualisation of the data in the cloud. gain an understanding of other concepts around IoT such as security. gain an an understanding of using Raspberry Pi and appropriate programming frameworks as the base to build all the projects, learn the fundamentals of IoT and then build a standard framework for developing all the applications. learn to capture data using sensors, and the basics of analysis and visualisation of the data in the cloud. gain an understanding of other concepts around IoT such as security. The course will be hands-on with students expected to work in groups to build complex and fun smart applications. This course requires the student to have their own laptop and Raspberry Pi kit","On completion of this course you should be able to: CLO1: Understand IoT principles, design and abstraction of developing IoT systems. CLO2: Develop on a variety of open source devices and software services. CLO3: Integrate a variety of IoT devices, sensors and services to build complex applications. CLO4: Learn the basics of Raspberry Pi and compatible programming frameworks. CLO5: Present and demonstrate the developed system. CLO1: Understand IoT principles, design and abstraction of developing IoT systems. CLO2: Develop on a variety of open source devices and software services. CLO3: Integrate a variety of IoT devices, sensors and services to build complex applications. CLO4: Learn the basics of Raspberry Pi and compatible programming frameworks. CLO5: Present and demonstrate the developed system. This course contributes to the following Program Learning Outcomes for Bachelor of Computer Science (BP094), Bachelor of Software Engineering (BP096),Bachelor of Information Technology (BP162) and other double degrees; You will gain skills as you apply knowledge effectively in diverse contexts. You will learn to accurately and objectively examine and consider computer science and information technology (IT) topics, evidence, or situations, in particular to: - analyse and model requirements and constraints for the purpose of designing and implementing software artefacts and IT systems. - evaluate and compare designs of software artefacts and IT systems on the basis of organisational and user requirements. Your capability to analyse problems and synthesise suitable solutions will be extended as you learn to: design and implement software solutions that accommodate specified requirements and constraints, based on analysis or modelling or requirements specification. You will learn to communicate effectively with a variety of audiences through a range of modes and media, in particular to: present a clear, coherent and independent exposition of software applications, alternative IT solutions, and decision recommendations to both IT and non-IT personnel via technical reports of professional standard and technical presentations. You will learn to work as an effective and productive team member in a range of professional and social situations, in particular to: work effectively in different roles, to form, manage, and successfully produce outcomes from teams, whose members may have diverse cultural backgrounds and life circumstances, and differing levels of technical expertise. You will be required to accept responsibility for your own learning and make informed decisions about judging and adopting appropriate behaviour in professional and social situations. This includes accepting the responsibility for independent life-long learning. Specifically, you will learn to: effectively apply relevant standards, ethical considerations, and an understanding of legal and privacy issues to designing software applications and IT systems",Programming Internet of Things
COSC2309,"This course is concerned with the development of applications on mobile computing platforms. Android will be used as a basis for teaching programming techniques and design patterns related to the development of standalone applications and mobile interfaces to enterprise and cloud systems. Emphasis is placed on the processes, tools and frameworks required to develop applications for current and emerging mobile computing devices. You should work at all stages of the software development life-cycle from inception through to implementation and testing. In doing so, you will be required to consider the impact of user characteristics, device capabilities, networking and cloud infrastructure and deployment environment, in order to develop software capable of meeting the requirements of stakeholders","This course is an option course and not a core course, so that it does not need to contribute to the Program Learning Outcomes. Upon successful completion of this course you should be able to",Mobile Application Development
COSC2673,"Machine Learning involves automatically identifying patterns in data to suggest future predictions about a task: e.g., predicting future house prices from historical data and trends. The explosion of data in different fields, such as health and finance, and in sources such as social media, has made Machine Learning an increasingly core Computer Science competency, with many companies investing in data analytics and the world’s major IT companies (such as Google, Facebook, and others) establishing Machine Learning labs. This course will introduce the basic Machine Learning concepts, covering supervised and unsupervised techniques, evaluation, as well as specific approaches such as deep neural networks. Students will learn how to apply such techniques to a range of problems, using open source Machine Learning toolkits, and learn how to analyse outputs from the applications. Students will perform assignments that involve a variety of real world datasets from a variety of domains","This course contributes to the following Program Learning Outcomes for BP094 Bachelor of Computer Science, BP096 Bachelor of Software Engineering, BP214 Bachelor of Information Technology (Games and Graphics Programming): You will gain skills as you apply knowledge effectively in diverse contexts. This will include knowledge of. You will learn to accurately and objectively examine and consider computer science and information technology (IT) topics, evidence, or situations, in particular to: -- analyse and model requirements and constraints for the purpose of designing and implementing solutions to a learning challenge; -- evaluate and compare approaches and algorithms on the basis of the nature of the problem/task being addressed. Your capability to analyse problems and synthesise suitable solutions will be extended as you learn to: select and apply algorithms to address particular machine learning problems, based on analysis of the problem and characteristics of the data involved. You will learn to communicate effectively with a variety of audiences through a range of modes and media, in particular to: interpret abstract theoretical propositions, choose methodologies, justify conclusions and defend professional decisions to both IT and non-IT personnel via technical reports of professional standard and technical presentations. You will be required to accept responsibility for your own learning and make informed decisions about judging and adopting appropriate behaviour in professional and social situations. This includes accepting the responsibility for independent life-long learning. Specifically, you will learn to: effectively analyse problems for appropriate approach, while accounting for ethical considerations. On completion of this course you should be able to: understand the fundamental concepts and algorithms of machine learning and applications. understand a range of machine learning methods and the kinds of problem to which they are suited. set up a machine learning configuration, including processing data and performing feature engineering, for a range of applications. apply machine learning software and toolkits for diverse applications. understand major application areas of machine learning. understand the ethical considerations involved in the application of machine learning. understand the fundamental concepts and algorithms of machine learning and applications. understand a range of machine learning methods and the kinds of problem to which they are suited. set up a machine learning configuration, including processing data and performing feature engineering, for a range of applications. apply machine learning software and toolkits for diverse applications. understand major application areas of machine learning. understand the ethical considerations involved in the application of machine learning",Machine Learning
COSC2471,"A Mac computer or a Mac laptop is required to complete this course. Latest version of ‘Xcode’ will be used to develop applications. Current SWIFT and the Apple iOS SDK will be used as a basis for teaching programming techniques and design patterns related to the development of standalone applications and mobile portals to enterprise and m-commerce systems. Emphasis is placed on the processes, tools and frameworks required to develop applications for Apple iPhone and iPad Touch devices. You will work at all stages of the software development life-cycle from inception through to implementation and testing. In doing so, you will be required to consider the impact of user characteristics, device capabilities, networking infrastructure and deployment environment, in order to develop software capable of meeting the requirements of stakeholders. This is not a course about design principles for a mobile application, it is a programming elective which requires you to have strong programming skills","This course contributes to the following program learning outcomes: Enabling Knowledge: You will gain skills as you apply knowledge effectively in diverse contexts. Enabling Knowledge: You will gain skills as you apply knowledge effectively in diverse contexts. You will gain skills as you apply knowledge effectively in diverse contexts. Critical Analysis: You will learn to accurately and objectively examine and consider computer science and information technology (IT) topics, evidence, or situations, in particular to: analyse and model requirements and constraints for the purpose of designing and implementing software artefacts and IT systems. evaluate and compare designs of software artefacts and IT systems on the basis of organisational and user requirements. Critical Analysis: You will learn to accurately and objectively examine and consider computer science and information technology (IT) topics, evidence, or situations, in particular to: analyse and model requirements and constraints for the purpose of designing and implementing software artefacts and IT systems. evaluate and compare designs of software artefacts and IT systems on the basis of organisational and user requirements. You will learn to accurately and objectively examine and consider computer science and information technology (IT) topics, evidence, or situations, in particular to: analyse and model requirements and constraints for the purpose of designing and implementing software artefacts and IT systems. evaluate and compare designs of software artefacts and IT systems on the basis of organisational and user requirements. analyse and model requirements and constraints for the purpose of designing and implementing software artefacts and IT systems. evaluate and compare designs of software artefacts and IT systems on the basis of organisational and user requirements. Problem Solving: Your capability to analyse problems and synthesise suitable solutions will be extended as you learn to: design and implement software solutions that accommodate specified requirements and constraints, based on analysis or modelling or requirements specification. Problem Solving: Your capability to analyse problems and synthesise suitable solutions will be extended as you learn to: design and implement software solutions that accommodate specified requirements and constraints, based on analysis or modelling or requirements specification. Your capability to analyse problems and synthesise suitable solutions will be extended as you learn to: design and implement software solutions that accommodate specified requirements and constraints, based on analysis or modelling or requirements specification. Communication: You will learn to communicate effectively with a variety of audiences through a range of modes and media, in particular to: present a clear, coherent and independent exposition of software applications, alternative IT solutions, and decision recommendations to both IT and non-IT personnel via technical reports of professional standard and technical presentations. Communication: You will learn to communicate effectively with a variety of audiences through a range of modes and media, in particular to: present a clear, coherent and independent exposition of software applications, alternative IT solutions, and decision recommendations to both IT and non-IT personnel via technical reports of professional standard and technical presentations. You will learn to communicate effectively with a variety of audiences through a range of modes and media, in particular to: present a clear, coherent and independent exposition of software applications, alternative IT solutions, and decision recommendations to both IT and non-IT personnel via technical reports of professional standard and technical presentations. Team Work: You will learn to work as an effective and productive team member in a range of professional and social situations, in particular to: work effectively in different roles, to form, manage, and successfully produce outcomes from teams, whose members may have diverse cultural. backgrounds and life circumstances, and differing levels of technical expertise. Team Work: You will learn to work as an effective and productive team member in a range of professional and social situations, in particular to: work effectively in different roles, to form, manage, and successfully produce outcomes from teams, whose members may have diverse cultural. backgrounds and life circumstances, and differing levels of technical expertise. You will learn to work as an effective and productive team member in a range of professional and social situations, in particular to: work effectively in different roles, to form, manage, and successfully produce outcomes from teams, whose members may have diverse cultural. backgrounds and life circumstances, and differing levels of technical expertise. Responsibility: You will be required to accept responsibility for your own learning and make informed decisions about judging and adopting appropriate behaviour in professional and social situations. This includes accepting the responsibility for independent life-long learning. Specifically, you will learn to: effectively apply relevant standards, ethical considerations, and an understanding of legal and privacy issues to designing software applications and IT systems. Responsibility: You will be required to accept responsibility for your own learning and make informed decisions about judging and adopting appropriate behaviour in professional and social situations. This includes accepting the responsibility for independent life-long learning. Specifically, you will learn to: effectively apply relevant standards, ethical considerations, and an understanding of legal and privacy issues to designing software applications and IT systems. You will be required to accept responsibility for your own learning and make informed decisions about judging and adopting appropriate behaviour in professional and social situations. This includes accepting the responsibility for independent life-long learning. Specifically, you will learn to: effectively apply relevant standards, ethical considerations, and an understanding of legal and privacy issues to designing software applications and IT systems. Research and scholarship. Research and scholarship. You will have technical and communication skills to design, evaluate, implement, analyse and theorise about developments that contribute to professional practice or scholarship, specifically you will have cognitive skills: to demonstrate mastery of theoretical knowledge and to reflect critically on theory and professional practice or scholarship; to plan and execute a substantial research-based project, capstone experience and/or piece of scholarship. to demonstrate mastery of theoretical knowledge and to reflect critically on theory and professional practice or scholarship; to plan and execute a substantial research-based project, capstone experience and/or piece of scholarship. Upon successful completion of this course you should be able to: CLO 1: describe the limitations and challenges of working in a mobile environment as well as the commercial and research opportunities presented by these technologies. CLO 2: apply the different types of application models/frameworks used to develop mobile software applications. CLO3: learn about the components and structure of the iPhone application development framework and know how and when to apply the different components to develop a working system. CLO 4: describe and apply software patterns for the development of the application models described above. CLO 5: design, implement and deploy Apple iPhone / iPad applications using an appropriate software development environment. CLO 6: apply critical analysis, problem solving, and team facilitation skills to mobile app software engineering scenarios. CLO 1: describe the limitations and challenges of working in a mobile environment as well as the commercial and research opportunities presented by these technologies. CLO 2: apply the different types of application models/frameworks used to develop mobile software applications. CLO3: learn about the components and structure of the iPhone application development framework and know how and when to apply the different components to develop a working system. CLO 4: describe and apply software patterns for the development of the application models described above. CLO 5: design, implement and deploy Apple iPhone / iPad applications using an appropriate software development environment. CLO 6: apply critical analysis, problem solving, and team facilitation skills to mobile app software engineering scenarios",iPhone Software Engineering
COSC1187,"The Computer Science and Information Technology course introduces techniques, algorithms and principles of interactive 3D computer graphics and animation, including graphics algorithms, the graphics pipeline and graphics programming. This course also prepares you for study in real-time rendering, realistic image synthesis, computer animation and game programming, which you study in more detail later in your program of learning","This course contributes to the following program learning outcomes: You will gain skills as you apply knowledge effectively in diverse contexts. You will learn to accurately and objectively examine and consider computer science and information technology (IT) topics, evidence, or situations, in particular to analyse and model requirements and constraints for the purpose of designing and implementing software artefacts and IT systems. Your capability to analyse problems and synthesise suitable solutions will be extended as you learn to: design and implement software solutions that accommodate specified requirements and constraints, based on analysis or modelling or requirements specification. Upon successful completion of this course you should be able to: identify and describe the fundamentals of 3D computer graphics. describe the basic requirements for computer animation. analyse requirements and constraints of 3D viewing, the 3D viewing pipeline, hidden surface removal, shading and illumination. design and develop interactive 3D programs using the OpenGL 3D graphics library. use graphics programming skills and knowledge, including visual debugging, to develop medium-sized interactive 3D graphics applications. apply mathematics and physics in the design and development of graphics applications. identify and describe the fundamentals of 3D computer graphics. describe the basic requirements for computer animation. analyse requirements and constraints of 3D viewing, the 3D viewing pipeline, hidden surface removal, shading and illumination. design and develop interactive 3D programs using the OpenGL 3D graphics library. use graphics programming skills and knowledge, including visual debugging, to develop medium-sized interactive 3D graphics applications. apply mathematics and physics in the design and development of graphics applications",Interactive 3D Graphics and Animation
