code,description,outcome,title
COSC1284,"This course introduces programming techniques, including Object-Oriented programming using the Java programming language. This course covers algorithm development using standard control structures, design methods such as step-wise refinement, the object oriented programming framework, the use of standard Java classes and interfaces, the use of container classes, disk file processing and introduces techniques for code reuse","This course contributes to the following Program Learning Outcomes (PLOs) for BP094 Bachelor of Computer Science. Enabling Knowledge: Enabling Knowledge: You will gain skills as you apply knowledge effectively in diverse contexts. Critical Analysis: Critical Analysis: You will learn to accurately and objectively examine and consider computer science and information technology (IT) topics, evidence, or situations, in particular to analyse and model requirements and constraints for the purpose of designing and implementing software artefacts and IT systems. Problem Solving: Problem Solving: Your capability to analyse problems and synthesise suitable solutions will be extended as you learn to: design and implement software solutions that accommodate specified requirements and constraints, based on analysis or modelling or requirements specification. Upon successful completion of this course you should be able to: Demonstrate (through small programming exercises) knowledge and skills with concepts of program design and acceptable coding standards. Use Java programming language as a vehicle to demonstrate good software development practices. Use arrays and control structures to demonstrate skills of basic algorithms and data structures. Apply knowledge of the basic principles of the object oriented development process to the analysis and design of solutions for small scale problems. Analyze requirements for a small scale programming project. Design and implement small-scale software systems. Explain the rationale for program design, data structures and user interface design chosen. Demonstrate skills for self-directed learning. Demonstrate (through small programming exercises) knowledge and skills with concepts of program design and acceptable coding standards. Use Java programming language as a vehicle to demonstrate good software development practices. Use arrays and control structures to demonstrate skills of basic algorithms and data structures. Apply knowledge of the basic principles of the object oriented development process to the analysis and design of solutions for small scale problems. Analyze requirements for a small scale programming project. Design and implement small-scale software systems. Explain the rationale for program design, data structures and user interface design chosen. Demonstrate skills for self-directed learning",Programming Techniques
COSC2627,"This course provides a foundation for Computer Science. Many other areas of Computer Science require the ability to work with concepts from discrete structures. Discrete structures include topics such as set theory, logic, graph theory, and probability theory. The material in discrete structures is pervasive in the areas of data structures and algorithms but appears elsewhere in Computer Science as well. In this course, you will learn about (1) sets, relations and functions; (2) basic logic, including propositional logic, logical connectives, truth tables, propositional inference rules and predicate logic; (3) proof techniques, including the structure of mathematical proofs, direct proofs, disproving by counterexample, proof by contradiction; (4) basics of counting, including counting arguments, the pigeonhole principle, permutations and combinations, solving recurrence relation; (5) graphs and trees; and, (6) discrete probability, including finite probability space, axioms of probability, conditional probability","This course contributes to the following Program Learning Outcomes in BP094 Bachelor of Computer Science and BP096 Bachelor of Software Engineering: You will gain skills as you apply knowledge effectively in diverse contexts. You will learn to accurately and objectively examine and consider computer science and information technology (IT) topics, evidence, or situations, in particular to: Analyse and model requirements and constraints for the purpose of designing and implementing software artefacts and IT systems. Evaluate and compare designs of software artefacts and IT systems on the basis of organisational and user requirements. Analyse and model requirements and constraints for the purpose of designing and implementing software artefacts and IT systems. Evaluate and compare designs of software artefacts and IT systems on the basis of organisational and user requirements. Your capability to analyse problems and synthesise suitable solutions will be extended as you learn to: Design and implement software solutions that accommodate specified requirements and constraints, based on analysis or modelling or requirements specification. Design and implement software solutions that accommodate specified requirements and constraints, based on analysis or modelling or requirements specification. Upon successful completion of this course you should be able to: CLO 1: Apply formal logic proofs and/or informal, but rigorous, logical reasoning to real problems, such as predicting the behaviour of software or solving problems such as puzzles. CLO 2: Demonstrate comprehension of discrete structures and their relevance within the context of computer science, in the areas of data structures and algorithms, in particular. CLO 3: Apply discrete structures into other computing problems such as formal specification, verification, databases, artificial intelligence, and cryptography. CLO 4: Demonstrate mathematical skills, analytical and critical thinking abilities. CLO 5: Communicate clearly and effectively using the technical language of the field correctly. CLO 1: Apply formal logic proofs and/or informal, but rigorous, logical reasoning to real problems, such as predicting the behaviour of software or solving problems such as puzzles. CLO 2: Demonstrate comprehension of discrete structures and their relevance within the context of computer science, in the areas of data structures and algorithms, in particular. CLO 3: Apply discrete structures into other computing problems such as formal specification, verification, databases, artificial intelligence, and cryptography. CLO 4: Demonstrate mathematical skills, analytical and critical thinking abilities. CLO 5: Communicate clearly and effectively using the technical language of the field correctly",Discrete Structures in Computing
COSC2821,"By completing this course, you will gain an overall technical expertise in development using cloud technologies and be prepared to take the AWS Certified Developer–Associate level AWS Certification exam. The course will help you to understand the development process on AWS platform while covering concepts such as containers, caching, lambda, building and deploying secure solutions","N/A. On completion of this course you should be able to: CLO 1: Comprehend development process on AWS. CLO 2: Configuring AWS Identity and storage. CLO 3: Develop with DynamoDB. CLO 4: Develop with Lambda, SQS, SNS. CLO 5: Building and deploying secure applications. CLO 6: Communicate using the proper language of the field including reports written with a professional approach. CLO 1: Comprehend development process on AWS. CLO 2: Configuring AWS Identity and storage. CLO 3: Develop with DynamoDB. CLO 4: Develop with Lambda, SQS, SNS. CLO 5: Building and deploying secure applications. CLO 6: Communicate using the proper language of the field including reports written with a professional approach",Cloud Developing
ISYS2423,"This course explores the concepts, issues and opportunities in the strategic management of Information Technology (IT) and Information Systems (IS). Strategic value of IT and the business IT/IS alignment is a core theme. The course then addresses the role of corporate governance and the role of IT/IS. Business analysis is used to develop a problem solving approach to IT strategy and governance. You will use knowledge of business practice, IT systems and strategy to uncover, explore and then resolve business problems and develop an understanding of their application to and integration with corporate and IT governance. This course includes a Work Integrated Learning (WIL) experience in which your knowledge and skills will be applied and assessed in a real or simulated workplace context and where feedback from industry and/or community is integral to your experience. This course also provides you with a capstone experience, which will give you the opportunity to integrate, critically reflect on and consolidate what you have learnt in your program",On successful completion of this course you will be able to: Review IT/IS at an enterprise level for compliance to accepted International Industry Standards. Recommend strategies for generating value via IT/IS value drivers and thus demonstrate operational effectiveness and efficiency for ICT systems in a variety of Business contexts. Evaluate existing organisational ICT policies and procedures to effectively recommend strategies that address the customer experience. Evaluates the factors which must be addressed in dynamic ICT business processes. Investigate and report on potential risk events in ICT Business Processes. Work to analyse business needs and problems and propose a range of relevant business solutions. Review IT/IS at an enterprise level for compliance to accepted International Industry Standards. Recommend strategies for generating value via IT/IS value drivers and thus demonstrate operational effectiveness and efficiency for ICT systems in a variety of Business contexts. Evaluate existing organisational ICT policies and procedures to effectively recommend strategies that address the customer experience. Evaluates the factors which must be addressed in dynamic ICT business processes. Investigate and report on potential risk events in ICT Business Processes. Work to analyse business needs and problems and propose a range of relevant business solutions,Information Systems Strategy
ISYS2047,"Information systems are the lifeblood of modern organisations as they are an integral part of most business activities. In this course, you will develop the necessary skills to design and implement information systems solutions to address basic business issues",On successful completion of this course you will be able to: Apply theoretical and technical knowledge of information systems to facilitate and support business practice. Select and apply various tools and techniques to effectively implement information systems to support business processes. - PROG Programming/Software Development (Level 3) - DBDS Database Repository Design (Level 2) - TEST Testing (Level 2) - CMFG Configuration Management (Level 2) Respond to issues and challenges faced by businesses and generate a range of potential solutions. Select appropriate information systems solutions to address specific business issues. - DESN Systems Design (Level 3) Design and implement information systems to address specific business issues. - DESN Systems Design (Level 3) - PROG Programming/Software Development (Level 3) - DBDS Database Repository Design (Level 2) - TEST Testing (Level 2) - CMFG Configuration Management (Level 2) Apply theoretical and technical knowledge of information systems to facilitate and support business practice. Select and apply various tools and techniques to effectively implement information systems to support business processes. - PROG Programming/Software Development (Level 3) - DBDS Database Repository Design (Level 2) - TEST Testing (Level 2) - CMFG Configuration Management (Level 2) Respond to issues and challenges faced by businesses and generate a range of potential solutions. Select appropriate information systems solutions to address specific business issues. - DESN Systems Design (Level 3) Design and implement information systems to address specific business issues. - DESN Systems Design (Level 3) - PROG Programming/Software Development (Level 3) - DBDS Database Repository Design (Level 2) - TEST Testing (Level 2) - CMFG Configuration Management (Level 2,Information Systems Solutions and Design
ISYS1051,"This course focuses on designing innovative solutions using digital technologies, to enhance the ability of businesses and community organisations to achieve strategic goals. The course will explore the evolving digital market and your opportunities in this space discussed. Critical problem solving skills will be developed within the context of real business situations through the application of a combination of system thinking, process modelling, business analysis and creative design techniques. A range of business and community enterprises will be systematically investigated during the semester within the framework of individual and group tutorial exercises. This course includes a Work Integrated Learning (WIL) experience in which your knowledge and skills will be applied and assessed in a real or simulated workplace context and where feedback from industry and/or community is integral to your experience","On successful completion of this course you will be able to: Analyse different types of business problems and their contexts and prepare a business analysis report to management. - TEST (Level 1) - DESN Systems Design (Level 1) - BUAN Business Analysis (Level 2) Apply systems thinking principles to understand and analyse complex business problems. - TEST (Level 1) - DESN Systems Design (Level 1) - BUAN Business Analysis (Level 2) Use a variety of modelling tools, conceptual frameworks and language of systems thinking to define and specify business system requirements. - BSMO Business Modelling (Level 2) - REQM Requirements Definition & Management (Level 1) Express ideas, concepts and arguments logically in writing when preparing business analysis reports to management. - PRMG Project Management (Level 1) - TEST (Level 1) - PRMG Project Management (Level 1) Communicate effectively when interacting verbally with clients. - PRMG Project Management (Level 1) - TEST (Level 1) Use common project management tools to monitor the progress of a project and to participate as an effective member of the project team. - PRMG Project Management (Level 1) - TEST (Level 1) Analyse different types of business problems and their contexts and prepare a business analysis report to management. - TEST (Level 1) - DESN Systems Design (Level 1) - BUAN Business Analysis (Level 2) Apply systems thinking principles to understand and analyse complex business problems. - TEST (Level 1) - DESN Systems Design (Level 1) - BUAN Business Analysis (Level 2) Use a variety of modelling tools, conceptual frameworks and language of systems thinking to define and specify business system requirements. - BSMO Business Modelling (Level 2) - REQM Requirements Definition & Management (Level 1) Express ideas, concepts and arguments logically in writing when preparing business analysis reports to management. - PRMG Project Management (Level 1) - TEST (Level 1) - PRMG Project Management (Level 1) Communicate effectively when interacting verbally with clients. - PRMG Project Management (Level 1) - TEST (Level 1) Use common project management tools to monitor the progress of a project and to participate as an effective member of the project team. - PRMG Project Management (Level 1) - TEST (Level 1",Digital Business Design and Innovation
COSC2382,"This course is a hands-on, career-oriented training with an emphasis on practical experience to help you develop specialized security skills to advance your careers. The curriculum helps prepare you for entry-level security career opportunities and for Implementing Cisco IOS Network Security (IINS) certification exam (210-260) leading to the Cisco CCNA Security certification","This course contributes to the following Program Learning Outcomes for AD006 Associate Degree in Information Technology: • Problem Solving. • Communication. • Responsibility. • Team Work. On completion of this course you should be able to: 1. Understand and implement appropriate technologies to secure a network. 2. Implement VPN. 3. Create a secure routing and switching network by implementing firewall technologies. 4. Implement IPS, Content & Endpoint Security",Advanced Networking 1
COSC2384,"This course extends your understanding of computer networking. It deepens your knowledge of Routing Protocols and introduces you to switched networks. You will develop skills in the Command Line Interface configuration of switches, port security, VLANs, VTP and inter-VLAN routing as well switch security,routing and MLS. It deepens your knowledge of wireless networks and also Wide Area Networks with emphasis on directly connected serial links, PPP authentication and redundancies technologies. You will develop skills in the configuration of advanced IP addressing techniques and the implementation of Access Control Lists","This course contributes to the following Program Learning Outcomes for AD006 Associate Degree in Information Technology: • Critical Analysis. • Problem Solving. • Responsibility. On completion of this course you should be able to: 1.Complete a review of skills from previous semester (Networking 1) which covers: IP addressing scheme, basic routing configuration, basic switching configuration, end device configuration and review troubleshooting. 2.Configure basic wireless technology, security and troubleshooting. 3.Implement various types of Switching and Routing Redundancies such as Etherchannel and HSRP. 4.Implement Advance Switch technology, involving switch security and troubleshooting. 5.Demonstrate and In-depth understanding and application of both EIGRP and OSPF both in IPv4 and IPv6 and troubleshooting. 6.Design, implement and troubleshooting high level security involving NAT, ACLs and authentication across WAN links in IPv4 and IPV6 environments",Networking 2
COSC2385,"This course introduces you to computer networking, particularly Local Area Networking. You will learn fundamental computer networking terms, concepts and components, IP address and subnetting. You will develop skills in basic network configuration (wired and wireless), routing protocols (static, RIP v2 and RIPng), switched networks, security, and troubleshooting. Pre-requisites, Co-requisites and Assumed Knowledge. Basic computer literacy and basic internet experience are mandatory. Prior experience with computer hardware, binary maths, basic electronics and command line interfaces is desirable","This course contributes to the following Program Learning Outcomes for AD006 Associate Degree in Information Technology: • Enabling Knowledge. • Critical Analysis. • Problem Solving. • Responsibility. On completion of this course you should be able to: 1. Analyse and explain operations of the OSI model in relation to Network Design. 2. Calculate Subnetting schemes and implement IP v4 addressing. 3. Configure & troubleshoot Ethernet Networks (wired and wireless) via Cisco CLI on Router and Switch platforms. 4. Describe and apply Dynamic Routing, Static Routes and security technologies based on given Network design. 5. Create Virtual Local Area Networks (VLANs) and test inter-VLAN communication across a router. 6. Optimise Network Devices to provide functionality for modern network systems",Networking 1
BUSM4687,"This course introduces you to contemporary theories about business responsibility in a global context, how these theories can be applied in practice, and the implications for management across a range of business functions. In the last 20 years a series of corporate scandals and financial crises have brought the question of how to manage international business responsibly to the attention of leaders and communities across the globe. Industry leaders are increasingly looking for employees who can think innovatively about this challenge. This course will provide you with knowledge and a range of skills to do that. You will learn how taking social and environmental issues into account can contribute to core business models and strategy. You will also learn how to work with a range of stakeholders to improve outcomes throughout the value chains of international business. You will be exposed to new ways of understanding and governing the relationship between business and society. Activities and assignments are designed to facilitate theory application and peer learning in a friendly, open atmosphere. This course includes a Work Integrated Learning experience in which your knowledge and skills will be applied and assessed in a real or simulated workplace context and where feedback from industry and/or community is integral to your experience",On successful completion of this course you will be able to,Global Corporate Responsibility
BUSM1222,"This course provides you with a fundamental understanding of international aspects of business and management, including international business contexts, actors and their actions. It addresses the theory and patterns of international business, as well as the macro and micro challenges in international business. This course provides a broad view of various factors underlying roles and responsibilities of international business in society",On successful completion of this course you will be able to,Global Business
BUSM1094,"In this course you will learn to critically examine alternative approaches for analysing and interpreting organisations. The course adopts a multiple perspective and interdisciplinary approach which provides you with toolset to analyse organisations through different theoretical lenses and at different levels: systems, structures, social interactions and the individual. It develops organisational analysis and critical reasoning skills through the application and assessment of different perspectives to business case studies examined in the course. The course examines different knowledge assumptions and their implications and practical consequences for future managers","None. On successful completion of this course you will be able to: CLO1. Identify different analytical perspectives employed to understand organisations at the individual, social, structural and systemic levels. CL02. Interpret and apply these multiple perspectives to empirically analyse specific organisations and the contexts in which they operate. CLO3. Draw on different analytical perspectives as the basis for a multidisciplinary approach towards organisational functionality, political and social relations. CLO4. Evaluate knowledge assumptions and come to recognise their management implications and practical consequences. CLO5. Assess and judge how organisational analysis can be used to engender solutions to organisational challenges that are socially responsible. CLO1. Identify different analytical perspectives employed to understand organisations at the individual, social, structural and systemic levels. CLO1. Identify different analytical perspectives employed to understand organisations at the individual, social, structural and systemic levels. CL02. Interpret and apply these multiple perspectives to empirically analyse specific organisations and the contexts in which they operate. CL02. Interpret and apply these multiple perspectives to empirically analyse specific organisations and the contexts in which they operate. CLO3. Draw on different analytical perspectives as the basis for a multidisciplinary approach towards organisational functionality, political and social relations. CLO3. Draw on different analytical perspectives as the basis for a multidisciplinary approach towards organisational functionality, political and social relations. CLO4. Evaluate knowledge assumptions and come to recognise their management implications and practical consequences. CLO4. Evaluate knowledge assumptions and come to recognise their management implications and practical consequences. CLO5. Assess and judge how organisational analysis can be used to engender solutions to organisational challenges that are socially responsible. CLO5. Assess and judge how organisational analysis can be used to engender solutions to organisational challenges that are socially responsible",Organisations
