code,description,outcome,title
COSC1078,"This course aims to provide you with the foundation knowledge of contemporary Information Technology areas, software, applications and job skills required to enter the IT market. A major component of the course is the practical application of the knowledge gained from the theoretical content. The material covers a broad range of introductory Information Technology concepts","This course contributes to the following program learning outcomes BP162 Bachelor of Information Technology: Enabling Knowledge: You will gain skills as you apply knowledge effectively in diverse contexts. Enabling Knowledge: You will gain skills as you apply knowledge effectively in diverse contexts. Critical Analysis: You will learn to accurately and objectively examine and consider computer science and information technology (IT) topics, evidence, or situations, in particular to: analyse and model requirements and constraints for the purpose of designing and implementing software artefacts and IT systems. Critical Analysis: You will learn to accurately and objectively examine and consider computer science and information technology (IT) topics, evidence, or situations, in particular to: analyse and model requirements and constraints for the purpose of designing and implementing software artefacts and IT systems. Problem Solving: Your capability to analyse problems and synthesise suitable solutions will be extended as you learn to: design and implement software solutions that accommodate specified requirements and constraints, based on analysis or modelling or requirements specification. Problem Solving: Your capability to analyse problems and synthesise suitable solutions will be extended as you learn to: design and implement software solutions that accommodate specified requirements and constraints, based on analysis or modelling or requirements specification. Communication: You will learn to communicate effectively with a variety of audiences through a range of modes and media, in particular to: present a clear, coherent and independent exposition of software applications, alternative IT solutions, and decision recommendations to both IT and non-IT personnel via technical reports of professional standard and technical presentations. Communication: You will learn to communicate effectively with a variety of audiences through a range of modes and media, in particular to: present a clear, coherent and independent exposition of software applications, alternative IT solutions, and decision recommendations to both IT and non-IT personnel via technical reports of professional standard and technical presentations. Team Work: You will learn to work as an effective and productive team member in a range of professional and social situations, in particular to: work effectively in different roles, to form, manage, and successfully produce outcomes from teams, whose members may have diverse cultural backgrounds and life circumstances, and differing levels of technical expertise. Team Work: You will learn to work as an effective and productive team member in a range of professional and social situations, in particular to: work effectively in different roles, to form, manage, and successfully produce outcomes from teams, whose members may have diverse cultural backgrounds and life circumstances, and differing levels of technical expertise. Upon successful completion of this course you should be able to: CLO 1: describe and apply basic concepts of contemporary technologies. CLO 2: analyse human and social contexts of technological innovations. CLO 3: apply the knowledge of various ICT components to create a prototype of a product/service. CLO 4: identify principles of collaborative work and explain potential conflict resolution techniques. CLO 5: participate effectively and creatively in a team environment. CLO 6: prepare a professional and comprehensively written IT report within provided parameters. CLO 1: describe and apply basic concepts of contemporary technologies. CLO 2: analyse human and social contexts of technological innovations. CLO 3: apply the knowledge of various ICT components to create a prototype of a product/service. CLO 4: identify principles of collaborative work and explain potential conflict resolution techniques. CLO 5: participate effectively and creatively in a team environment. CLO 6: prepare a professional and comprehensively written IT report within provided parameters",Introduction to Information Technology
COSC2625,"IT today is everywhere and is involved in many aspects of life, including mobile devices, electronic voting and robotic fish. Many advances have come from people passionately following an inspiration, and developing it into a concrete outcome. This course is an opportunity for you to pursue an idea in IT and to work with a team of like-minded people to develop it. You will be provided with assistance to choose an appropriate topic, find a project team, generate a project plan, and to implement your project. This course is designed to engage and inspire you with the wide world of IT, with a particular emphasis on finding appropriate tools, methodologies and techniques to meet your own personal challenge. This course will give you substantial hands-on, practical learning experiences and aims to motivate you through engagement in the creative, explorative and meaningful development of technological artefacts that operate in real world contexts","This course contributes to the following program learning outcomes for BP162 Bachelor of Information Technology and BP232 Bachelor of Technology (Computing Studies): You will gain skills as you apply knowledge effectively in diverse contexts. You will learn to accurately and objectively examine and consider computer science and information technology (IT) topics, evidence, or situations, in particular to: - analyse and model requirements and constraints for the purpose of designing and implementing software artefacts and IT systems. - evaluate and compare designs of software artefacts and IT systems on the basis of organisational and user requirements. Your capability to analyse problems and synthesise suitable solutions will be extended as you learn to: design and implement software solutions that accommodate specified requirements and constraints, based on analysis or modelling or requirements specification. You will learn to communicate effectively with a variety of audiences through a range of modes and media, in particular to: present a clear, coherent and independent exposition of software applications, alternative IT solutions, and decision recommendations to both IT and non-IT personnel via technical reports of professional standard and technical presentations. You will learn to work as an effective and productive team member in a range of professional and social situations, in particular to: work effectively in different roles, to form, manage, and successfully produce outcomes from teams, whose members may have diverse cultural backgrounds and life circumstances, and differing levels of technical expertise. Upon successful completion of this course you should be able to: locate and assess tools and resources for IT systems, apply knowledge to a wide variety of experiences in programming or scripting, networks and databases to design and develop IT systems. identify, decompose and solve problems related to creation of IT system prototypes. effectively communicate project outcomes in a written report. work independently and collaboratively to develop small IT systems. evaluate and provide feedback on the work of your peers. locate and assess tools and resources for IT systems, apply knowledge to a wide variety of experiences in programming or scripting, networks and databases to design and develop IT systems. identify, decompose and solve problems related to creation of IT system prototypes. effectively communicate project outcomes in a written report. work independently and collaboratively to develop small IT systems. evaluate and provide feedback on the work of your peers",Building IT Systems
COSC2626,"Cloud Computing is a large-scale distributed computing paradigm which has become a driving force for information technology over the past several years. The exponential growth data size in scientific instrumentation/simulation and social media has triggered the wider use of cloud computing services. This course covers topics and technologies related to Cloud Computing and their practical implementations. You should explore different architectural models of cloud computing, the concepts of virtualisation and cloud orchestration. You should gain hands-on experience with various features of popular cloud platforms such as Google App Engine and Amazon Web Service throughout the lectures, tutorials, and laboratory sessions. Advanced cloud programming paradigms such as Hadoop’s MapReduce is also included in the course. You should also learn the concept of modern Big Data analysis on cloud platforms using various data mining tools and techniques. The lab sessions cover cloud application development and deployment, use of cloud storage, creation and configuration of virtual machines and data analysis on cloud using data mining tools. Different application scenarios from popular domains that leverage the cloud technologies such as remote healthcare and social networks will be explained. The theoretical knowledge, practical sessions and assignments aim to help you to build your skills to develop large-scale industry standard applications using cloud platforms and tools. This course focuses on learning emerging issues related to Cloud computing technology. The objectives are: Understand various basic concepts related to cloud computing technologies. Understand the architecture and concept of different cloud models: IaaS, PaaS, SaaS. Understand big data analysis tools and techniques. Understand the underlying principle of cloud virtualization, cloud storage, data management and data visualization. Understand different cloud programming platforms and tools. Have details knowledge on reading and writing in cloud storage. Be familiar with application development and deployment using cloud platforms. Create application by utilizing cloud platforms such as Google app Engine and Amazon Web Services (AWS) Learn to develop scalable applications using AWS features. Learn basic concepts of MapReduce programming models for big data analysis on cloud. Understand various basic concepts related to cloud computing technologies. Understand the architecture and concept of different cloud models: IaaS, PaaS, SaaS. Understand big data analysis tools and techniques. Understand the underlying principle of cloud virtualization, cloud storage, data management and data visualization. Understand different cloud programming platforms and tools. Have details knowledge on reading and writing in cloud storage. Be familiar with application development and deployment using cloud platforms. Create application by utilizing cloud platforms such as Google app Engine and Amazon Web Services (AWS) Learn to develop scalable applications using AWS features. Learn basic concepts of MapReduce programming models for big data analysis on cloud","This course is an option course so it is not required to contribute to the development of program learning outcomes (PLOs) though it may assist your achievement of several PLOs such as: Enabling Knowledge: Enabling Knowledge: You will gain skills as you apply knowledge effectively in diverse contexts. Critical Analysis: Critical Analysis: You will learn to accurately and objectively examine and consider computer science and information technology (IT) topics, evidence, or situations, in particular to: analyse and model requirements and constraints for the purpose of designing and implementing software artefacts and IT systems. Problem Solving: Problem Solving: Your capability to analyse problems and synthesise suitable solutions will be extended as you learn to: design and implement software solutions that accommodate specified requirements and constraints, based on analysis or modelling or requirements specification. Communication: Communication: You will learn to communicate effectively with a variety of audiences through a range of modes and media, in particular to: present a clear, coherent and independent exposition of software applications, alternative IT solutions, and decision recommendations to both IT and non-IT personnel via technical reports of professional standard and technical presentations. Team Work: Team Work: You will learn to work as an effective and productive team member in a range of professional and social situations, in particular to: work effectively in different roles, to form, manage, and successfully produce outcomes from teams, whose members may have diverse cultural backgrounds and life circumstances, and differing levels of technical expertise. Upon successful completion of this course you should be able to: CLO 1: Develop and deploy cloud application using popular cloud platforms, CLO 2: Design and develop highly scalable cloud-based applications by creating and configuring virtual machines on the cloud and building private cloud. CLO 3: Explain and identify the techniques of big data analysis in cloud. CLO 4: Compare, contrast, and evaluate the key trade-offs between multiple approaches to cloud system design, and Identify appropriate design choices when solving real-world cloud computing problems. CLO 5: Write comprehensive case studies analysing and contrasting different cloud computing solutions. CLO 6: Make recommendations on cloud computing solutions for an enterprise. CLO 1: Develop and deploy cloud application using popular cloud platforms, CLO 2: Design and develop highly scalable cloud-based applications by creating and configuring virtual machines on the cloud and building private cloud. CLO 3: Explain and identify the techniques of big data analysis in cloud. CLO 4: Compare, contrast, and evaluate the key trade-offs between multiple approaches to cloud system design, and Identify appropriate design choices when solving real-world cloud computing problems. CLO 5: Write comprehensive case studies analysing and contrasting different cloud computing solutions. CLO 6: Make recommendations on cloud computing solutions for an enterprise",Cloud Computing
COSC2123,"The main objective of this course is for you to acquire the tools and techniques necessary to propose practical algorithmic solutions to real-world problems which still allow strong theoretical bounds on time and space usage. You will study a broad variety of important and useful algorithms and data structures in different areas of applications, and will concentrate on fundamental algorithms. You will spend a significant time on each algorithm to understand its essential characteristics and to respect its subtleties","This course contributes to the following Program Learning Outcomes (PLOs) for BP094 Bachelor of Computer Science, BP096 Bachelor of Software Engineering, BP215 Bachelor of Information Technology (Games and Graphics Programming), BH094 Bachelor of Engineering (Electronic & Communication Engineering (Hons)/Bachelor of Computer Science, BH091 - Bachelor of Engineering (Computer and Network Engineering) (Honours)/Bachelor of Computer Science, MC061 Master of Computer Science, and MC208 Master of Information Technology: Enabling Knowledge: You will gain skills as you apply knowledge effectively in diverse contexts. Enabling Knowledge: You will gain skills as you apply knowledge with creativity and initiative to new situations. In doing so, you will: Demonstrate mastery of a body of knowledge that includes recent developments in computer science and information technology; Recognise and use research principles and methods applicable to computer science and information technology. Enabling Knowledge: You will gain skills as you apply knowledge effectively in diverse contexts. Enabling Knowledge: You will gain skills as you apply knowledge with creativity and initiative to new situations. In doing so, you will: Demonstrate mastery of a body of knowledge that includes recent developments in computer science and information technology; Recognise and use research principles and methods applicable to computer science and information technology. Critical Analysis: You will learn to accurately and objectively examine and consider computer science and information technology (IT) topics, evidence, or situations, in particular to: (i) Analyse and model requirements and constraints for the purpose of designing and implementing software artefacts and IT systems; (ii) Evaluate and compare designs of software artefacts and IT systems on the basis of organisational and user requirements. Critical Analysis: You will learn to accurately and objectively examine and consider computer science and information technology (IT) topics, evidence, or situations, in particular to: (i) Analyse and model requirements and constraints for the purpose of designing and implementing software artefacts and IT systems; (ii) Evaluate and compare designs of software artefacts and IT systems on the basis of organisational and user requirements. Problem Solving: Your capability to analyse problems and synthesise suitable solutions will be extended as you learn to: Design and implement software solutions that accommodate specified requirements and constraints, based on analysis or modelling or requirements specification. Problem Solving: Your capability to analyse problems and synthesise suitable solutions will be extended as you learn to: Design and implement software solutions that accommodate specified requirements and constraints, based on analysis or modelling or requirements specification. Communication: You will learn to communicate effectively with a variety of audiences through a range of modes and media, in particular to: Present a clear, coherent and independent exposition of software applications, alternative IT solutions, and decision recommendations to both IT and non-IT personnel via technical reports of professional standard and technical presentations. Interpret abstract theoretical propositions, choose methodologies, justify conclusions and defend professional decisions to both IT and non-IT personnel via technical reports of professional standard and technical presentations. Communication: You will learn to communicate effectively with a variety of audiences through a range of modes and media, in particular to: Present a clear, coherent and independent exposition of software applications, alternative IT solutions, and decision recommendations to both IT and non-IT personnel via technical reports of professional standard and technical presentations. Interpret abstract theoretical propositions, choose methodologies, justify conclusions and defend professional decisions to both IT and non-IT personnel via technical reports of professional standard and technical presentations. Team Work: You will learn to work as an effective and productive team member in a range of professional and social situations, in particular to: Work effectively in different roles, to form, manage, and successfully produce outcomes from teams whose members may have diverse cultural backgrounds and life circumstances and differing levels of technical expertise. Team Work: You will learn to work as an effective and productive team member in a range of professional and social situations, in particular to: Work effectively in different roles, to form, manage, and successfully produce outcomes from teams whose members may have diverse cultural backgrounds and life circumstances and differing levels of technical expertise. On successful completion of this course you should be able to: CLO 1: Compare, contrast, and apply the key algorithmic design paradigms: brute force, divide and conquer, decrease and conquer, transform and conquer, greedy, dynamic programming and iterative improvement; CLO 2: Compare, contrast, and apply key data structures: trees, lists, stacks, queues, hash tables and graph representations; CLO 3: Define, compare, analyse, and solve general algorithmic problem types: sorting, searching, graphs and geometric; CLO 4: Theoretically compare and analyse the time complexities of algorithms and data structures; and. CLO 5: Implement, empirically compare, and apply fundamental algorithms and data structures to real-world problems. CLO 1: Compare, contrast, and apply the key algorithmic design paradigms: brute force, divide and conquer, decrease and conquer, transform and conquer, greedy, dynamic programming and iterative improvement; CLO 2: Compare, contrast, and apply key data structures: trees, lists, stacks, queues, hash tables and graph representations; CLO 3: Define, compare, analyse, and solve general algorithmic problem types: sorting, searching, graphs and geometric; CLO 4: Theoretically compare and analyse the time complexities of algorithms and data structures; and. CLO 5: Implement, empirically compare, and apply fundamental algorithms and data structures to real-world problems",Algorithms and Analysis
