code,description,outcome,title
COSC2829,"By completing this course, you will gain an overall understanding of fundamentals of building IT infrastructure on AWS. The course is designed to teach solutions architects how to optimise their use of the AWS Cloud by understanding AWS services and how they fit into cloud-based solutions. Throughout the course, you will explore case studies that showcase how some AWS customers have designed their infrastructures and the strategies and services that they have implemented. Finally, this course provides opportunities for you to build a variety of infrastructures through a guided, hands-on approach","N/A. On completion of this course you should be able to: CLO 1: Understand concepts of cloud computing with Amazon Web Services. CLO 2: Understand concepts around AWS-powered applications. CLO 3: Understand key concepts around architectural components. CLO 4: Create, manage and provision applications using AWS platform. CLO 5: Understand the design principles, security and best practices around application development. CLO 6: Communicate with clients in a professional manner, delivering presentations and writing technical research reports using the appropriate language of the field. CLO 1: Understand concepts of cloud computing with Amazon Web Services. CLO 2: Understand concepts around AWS-powered applications. CLO 3: Understand key concepts around architectural components. CLO 4: Create, manage and provision applications using AWS platform. CLO 5: Understand the design principles, security and best practices around application development. CLO 6: Communicate with clients in a professional manner, delivering presentations and writing technical research reports using the appropriate language of the field",Cloud Architecting
INTE1113,"This course, Web3D and Graphics Technologies, introduces fundamentals of 3D computer graphics and graphics programming using 3D web technologies, focusing on standards like WebGL and X3D","This course contributes to the following program learning outcomes: You will gain skills as you apply knowledge effectively in diverse contexts. Your capability to analyse problems and synthesise suitable solutions will be extended as you learn to: design and implement software solutions that accommodate specified requirements and constraints, based on analysis or modelling or requirements specification. Upon successful completion of this course you should be able to: apply knowledge and skills of fundamentals of 3D graphics, including geometry modelling, hierarchical transformations, lighting and shading, texturing, and simple animation to Web 3D and graphics technologies. design and develop web 3D and graphics using X3D, WebGL and Javascript languages. build 3D web applications and solve related problems. construct scenes using the scene graph concept and facilities in WebGL and X3D. use Javascript at a basic level to build WebGL applications and perform basic 3D graphics programming. apply knowledge and skills of fundamentals of 3D graphics, including geometry modelling, hierarchical transformations, lighting and shading, texturing, and simple animation to Web 3D and graphics technologies. design and develop web 3D and graphics using X3D, WebGL and Javascript languages. build 3D web applications and solve related problems. construct scenes using the scene graph concept and facilities in WebGL and X3D. use Javascript at a basic level to build WebGL applications and perform basic 3D graphics programming",Web3D and Graphics Technologies
COSC2799,IT Studio 1 is an introductory studio-based course that focuses on the acquisition and development of fundamental technical and professional skills for the IT industry. The studio-based approach provides an authentic problem setting. Theory and practice are blended in the application of learning centered on development of e.g. IT products and services,"N/A. Upon successful completion of this course you should be able to: CLO1: Design and develop programming solutions for small scale practical problems. CLO2: Apply knowledge of various ICT components to design a product/service. CLO3: Demonstrate effective team participation and effective communication using accurate technical vocabulary. CLO4: Identify and use strategies, including reflective frameworks and peer feedback, to fill knowledge gaps and improve professional practice. CLO5: Demonstrate adherence to appropriate standards and practice of professionalism through use of version control systems",IT Studio 1
MATH2412,"Mathematics for Computing 2 aims to provide a broad introduction to the fundamental mathematical procedures (differentiation and integration) and mathematical objects (vectors, differential equations, matrices) of continuous (i.e. non-discrete) mathematics needed by computer scientists. The course builds on the foundations laid in secondary school mathematics and supports later courses in the computer science program, particularly those involved with algorithmic complexity, machine learning and evolutionary computing, computer graphics, scientific computing, physical modelling and visualisation. Topic areas include differentiation with applications, functions and their derivatives, integration and its applications, methods of integration, vectors, matrices, vector valued functions, differential equations","This course contributes to the following Program Learning Outcomes for BP09421 Bachelor of Computer Science (Studios), BP096P21 Bachelor of Software Engineering (Studios) and BP215 P21 Bachelor of Information Technology (Games and Graphics Programming) (Studios): You will gain skills as you apply knowledge effectively in diverse contexts. Your capability to analyse problems and synthesise suitable solutions will be extended as you learn to: - Design and implement software solutions that accommodate specified requirements and constraints, based on analysis or modelling or requirements specification. Upon successful completion of this course you should be able to",Mathematics for Computing 2
COSC2802,"Programming Bootcamp 2 builds on Programming Bootcamp 1, in a bootcamp style, i.e. in a focussed mode over a period of 4 or 5 weeks. This course covers advanced algorithms and data structures. This course serves as a pre-requisite for more specialized courses that requires programming","This course contributes to the following Program Learning Outcomes for BP09421 Bachelor of Computer Science (Studios), BP096P21 Bachelor of Software Engineering (Studios) and BP215P21 Bachelor of Information Technology (Games and Graphics Programming) (Studios): You will gain skills as you apply knowledge effectively in diverse contexts. You will learn to accurately and objectively examine and consider computer science and information technology (IT) topics, evidence, or situations, in particular to: - Analyse and model requirements and constraints for the purpose of designing and implementing software artefacts and IT systems. - Evaluate and compare designs of software artefacts and IT systems on the basis of organisational and user requirements. Your capability to analyse problems and synthesise suitable solutions will be extended as you learn to: - Design and implement software solutions that accommodate specified requirements and constraints, based on analysis or modelling or requirements specification. You will be required to accept responsibility for your own learning and make informed decisions about judging and adopting appropriate behaviour in professional and social situations. This includes accepting the responsibility for independent life-long learning. Specifically, you will learn to: - Effectively apply relevant standards, ethical considerations, and an understanding of legal and privacy issues to designing software applications and IT systems. Upon successful completion of this course you should be able to: - CLO1: Apply comprehensive knowledge of advanced programming concepts in solving practical problems. - CLO 2: Analyse and design algorithmic solutions for small to medium scale practical problems. - CLO 3: Create and evaluate programming solutions for small to medium scale software systems. - CLO 4: Use reflective practice to develop contemporary industry informed professional practice. - CLO 5: Identify personal learning needs and evaluate the quality of self-identified resources to support self-directed learning",Programming Bootcamp 2
MATH2411,"Mathematics for Computing 1 provides a foundation for Computer Science. Many other areas of Computer Science require the ability to work with concepts from discrete structures. Discrete structures include topics such as set theory, logic, and graph theory. The material in discrete structures is pervasive in the areas of data structures and algorithms but appears elsewhere in Computer Science as well","This course contributes to the following Program Learning Outcomes for BP09421 Bachelor of Computer Science (Studios), BP096P21 Bachelor of Software Engineering (Studios) and BP215P21 Bachelor of Information Technology (Games and Graphics Programming) (Studios): You will gain skills as you apply knowledge effectively in diverse contexts. Your capability to analyse problems and synthesise suitable solutions will be extended as you learn to: - Design and implement software solutions that accommodate specified requirements and constraints, based on analysis or modelling or requirements specification. Upon successful completion of this course you should be able to",Mathematics for Computing 1
COSC2801,"Programming Bootcamp 1 introduces programming in a bootcamp style. This course covers algorithmic development using standard control structures, fundamental concepts of programming and creation of small to medium practical applications. In this course you will learn the basic skills of program development by working on the production of small amounts of software. This will include skills in testing and debugging programs, and in the use of appropriate software technologies","Program Learning Outcomes (PLOs): This course contributes to the following Program Learning Outcomes for BP094P21 Bachelor of Computer Science (Studios), BP096P21 Bachelor of Software Engineering (Studios) and BP215P21 Bachelor of Information Technology (Games and Graphics Programming) (Studios): - You will gain skills as you apply knowledge effectively in diverse contexts. - Your capability to analyse problems and synthesise suitable solutions will be extended as you learn to: - Design and implement software solutions that accommodate specified requirements and constraints, based on analysis or modelling or requirements specification. You will be required to accept responsibility for your own learning and make informed decisions about judging and adopting appropriate behaviour in professional and social situations. This includes accepting the responsibility for independent life-long learning. Specifically, you will learn to: - Effectively apply relevant standards, ethical considerations, and an understanding of legal and privacy issues to designing software applications and IT systems. Upon successful completion of this course you should be able to",Programming Bootcamp 1
COSC1183,"Usability is the extent to which a product can be used by specified users to achieve specified goals with effectiveness, efficiency and satisfaction in a specified context of use Usability engineering is a set of behavioural research methods and techniques that can be applied at every stage of the software development lifecycle, to improve the usability of the developed product by conducting usability studies that analyse users’ needs or evaluate the product’s usability. This course introduces you to concepts, methods and techniques that you can apply to design and conduct usability studies, building on your practical experience with software system analysis and design, and with writing and testing code. You will learn the theory and practice of various approaches, methods and techniques, and apply these to acquire practical experience in conducting usability studies for interactive systems. Tutorial activities provide the skills you need to complete assignments where you design a usability test of an interactive system, recruit suitable participants, conduct the test, and analyse and report on your findings","The post-graduate offering contributes to the following program learning outcomes in. MC060 Master of Computer Science. MC061 M Computer Science. MC062 Master of Computing. MC063 M Tech(Internet & Web Comp) MC208 M Information Technology. MC060 Master of Computer Science. MC061 M Computer Science. MC062 Master of Computing. MC063 M Tech(Internet & Web Comp) MC208 M Information Technology. Upon successful completion of this course you should be able to: justify the theory and practice of usability evaluation approaches, methods and techniques. compare and evaluate strengths and weaknesses of various approaches, methods and techniques for evaluating usability. design and implement a usability test plan, based on modelling or requirements specification. choose appropriate approaches, methods and techniques to evaluate the usability of a specified interactive system. devise, perform and analyse experiments to evaluate the usability of a specified interactive system. write professional reports to: explain and justify usability concepts; describe results of user studies; make recommendations to stakeholders. justify the theory and practice of usability evaluation approaches, methods and techniques. compare and evaluate strengths and weaknesses of various approaches, methods and techniques for evaluating usability. design and implement a usability test plan, based on modelling or requirements specification. choose appropriate approaches, methods and techniques to evaluate the usability of a specified interactive system. devise, perform and analyse experiments to evaluate the usability of a specified interactive system. write professional reports to: explain and justify usability concepts; describe results of user studies; make recommendations to stakeholders",Usability Engineering
COSC1133,"This course provides an intensely practical introduction to basic Unix Systems Management, which involves both administration and programming . The Linux Operating Systemwill be used extensively throughout this course for lecture/tutorial examples and importantly during laboratory classes. In addition to system administration, TCP/IP network service administration and the use of scripting languages will be introduced","This course is an option course so it is not required to contribute to the development of program learning outcomes (PLOs) though it may assist your achievement of several PLOs. Upon successful completion of this course you should be able to: CLO 1: Demonstrate knowledge of the role and responsibilities of a Unix system administrator. CLO 2: Install and configure the Linux operating system. CLO 3: Manage the resources and security of a computer running Linux at a basic level. CLO 4: Make effective use of Unix utilities, and scripting languages. CLO 5: Configure and manage simple TCP/IP network services on a Linux system. CLO 1: Demonstrate knowledge of the role and responsibilities of a Unix system administrator. CLO 2: Install and configure the Linux operating system. CLO 3: Manage the resources and security of a computer running Linux at a basic level. CLO 4: Make effective use of Unix utilities, and scripting languages. CLO 5: Configure and manage simple TCP/IP network services on a Linux system",Unix Systems Administration and Programming (Linux
ISYS1089,"Building large-scale software systems requires important strategic and technical decisions from the outset. The primary aims of this course are to provide a sound understanding of architecture concepts, functions, tasks and techniques, and how the systems constituent parts interact. You will be exposed to the practical aspects of architecture through the analysis of case studies and design exercises. In particular, the course introduces you to architecture principles and tactics to support development of systems that exhibit system qualities required for successful software systems, such as performance, availability, security, and maintainability. Introduced throughout are strategies for technical analysis and evaluation of candidate architectures and decisions, communicating with stakeholders, and documenting an architecture","This course contributes to the following program learning outcomes: You will gain skills as you apply knowledge with creativity and initiative to new situations. In doing so, you will recognise and use principles and methods applicable to enterprise architecture. You will gain skills as you apply knowledge with creativity and initiative to new situations. In doing so, you will recognise and use principles and methods applicable to enterprise architecture. You will learn to accurately and objectively examine, and critically investigate enterprise architecture concepts, evidence, theories or situations, in particular to: Analyse and model complex requirements and constraints for the purpose of designing, implementing and integrating software infrastructure to deliver business-focussed IT solutions across an enterprise; Critically evaluate and compare alternative software systems architectures on the basis of organisational strategy and enterprise requirements. You will learn to accurately and objectively examine, and critically investigate enterprise architecture concepts, evidence, theories or situations, in particular to: Analyse and model complex requirements and constraints for the purpose of designing, implementing and integrating software infrastructure to deliver business-focussed IT solutions across an enterprise; Critically evaluate and compare alternative software systems architectures on the basis of organisational strategy and enterprise requirements. Your capability to analyse complex problems and synthesise suitable solutions will be extended as you learn to: Design architectural solutions that address challenges in modern large-scale software systems; Plan and develop solutions to deliver IT infrastructure projects in a timely and accurately estimated manner to meet organisational cost and budget constraints. Your capability to analyse complex problems and synthesise suitable solutions will be extended as you learn to: Design architectural solutions that address challenges in modern large-scale software systems; Plan and develop solutions to deliver IT infrastructure projects in a timely and accurately estimated manner to meet organisational cost and budget constraints. You will learn to lead, influence and communicate effectively with a variety of audiences, in particular to: Interpret identified enterprise business needs, communicate architectural decisions and strategy to meet those needs, articulate risks and benefits of those decisions to the enterprise, and choose appropriate methods of communication; Influence and convince internal and external stakeholders of decisions and strategies; stakeholders including both IT and business personnel, clients and enterprise-level decision makers. You will learn to lead, influence and communicate effectively with a variety of audiences, in particular to: Interpret identified enterprise business needs, communicate architectural decisions and strategy to meet those needs, articulate risks and benefits of those decisions to the enterprise, and choose appropriate methods of communication; Influence and convince internal and external stakeholders of decisions and strategies; stakeholders including both IT and business personnel, clients and enterprise-level decision makers. You will learn to work as an effective and productive team member in a range of professional and social situations, in particular to work effectively in different roles, to form, manage, and successfully produce outcomes from collaborative teams, whose members may have diverse cultural backgrounds and life circumstances, and differing levels of technical or business expertise. You will learn to work as an effective and productive team member in a range of professional and social situations, in particular to work effectively in different roles, to form, manage, and successfully produce outcomes from collaborative teams, whose members may have diverse cultural backgrounds and life circumstances, and differing levels of technical or business expertise. You will have technical and communication skills to design, evaluate, implement, analyse and theorise about developments that contribute to professional practice or scholarship, specifically you will have cognitive skills to demonstrate mastery of theoretical knowledge and to reflect critically on theory and professional practice or scholarship. Upon successful completion of this course you should be able to: appreciate standard architecture tactics and patterns and how to apply them appropriately to common challenges; analyse problems, consider various candidate solutions and synthesise suitable technical architectures that deliver appropriate system qualities, within specified constraints of cost and feasibility; investigate state-of-art best practice technical approaches to resolve architectural challenges such as improving performance, security and availability; effectively communicate a systems architecture, via a written report and oral presentation to different stakeholders (e.g., client, engineers) and convince them of the effectiveness of the proposed solution; work with team members to propose, discuss, and evaluate candidate architecture solutions, and produce outcomes from teams whose members come from diverse backgrounds and have differing levels of technical expertise and experience. appreciate standard architecture tactics and patterns and how to apply them appropriately to common challenges; analyse problems, consider various candidate solutions and synthesise suitable technical architectures that deliver appropriate system qualities, within specified constraints of cost and feasibility; investigate state-of-art best practice technical approaches to resolve architectural challenges such as improving performance, security and availability; effectively communicate a systems architecture, via a written report and oral presentation to different stakeholders (e.g., client, engineers) and convince them of the effectiveness of the proposed solution; work with team members to propose, discuss, and evaluate candidate architecture solutions, and produce outcomes from teams whose members come from diverse backgrounds and have differing levels of technical expertise and experience",Systems Architecture
COSC2274,"Requirements Engineering (RE) provides the basis for successful software development, and is increasingly recognized by practitioners as one of the most important stages in the software development life cycle. For these reasons, it also has attracted much interest in the research community and In this course, you will learn about the systematic approaches for elicitation, analysis, modeling, specification and validation of software requirements. The course covers such topics as: Why is RE important for the industry practice? What are the core principles of RE (definitions, process, roles, management, etc.)? How do we elicit requirements? How do we specify requirements using industry standards? What reference structures can we apply for RE? What modelling approaches can we apply to support RE? What are Domain and Usage Models? How do we ensure that RE is done properly? What is Quality Assurance? Why is RE important for the industry practice? What are the core principles of RE (definitions, process, roles, management, etc.)? How do we elicit requirements? How do we specify requirements using industry standards? What reference structures can we apply for RE? What modelling approaches can we apply to support RE? What are Domain and Usage Models? How do we ensure that RE is done properly? What is Quality Assurance","Upon successful completion of this course you should be able to: CLO1: Identify and analyse stakeholders and their needs, CLO2: Apply the core principles of RE. CL03: Elicit and specify requirements using industry standards, CLO4: Apply corresponding reference structures (frameworks), CLO5: Create models of requirements using a variety of notations and techniques, including domain and usage models, CLO6: Apply quality assurance techniques. CLO1: Identify and analyse stakeholders and their needs, CLO2: Apply the core principles of RE. CL03: Elicit and specify requirements using industry standards, CLO4: Apply corresponding reference structures (frameworks), CLO5: Create models of requirements using a variety of notations and techniques, including domain and usage models, CLO6: Apply quality assurance techniques",Software Requirements Engineering
